{"small_version":"2.0.0","project_id":"project_a89af76cb6a8d3fb5d3e29ac22a0c35d","lineage_id":"lineage_1ae9a2104e6dbeaa037eef39d97d39d2","session_id":"session_9f52191b16868ae8e23aa0353f49e415","event_id":"event_40235faf491d995ddc93a3631f9ce439","kind":"session_started","sequence":1,"parents":["event_c8507d057c04b4a27e28bbbf93168ecb"],"occurred_at":"2026-09-17T16:22:42.358067Z","payload":{"label":"implementation","observed_frontier":"1ab2ed72f342d0dc6b3f4cbd05d53502a07fc46bcbd97e00fbc3a36037a374f4"},"digest":"6a839a5fcd368fe446a1013adda6034a23804adb30d4edd5ef1aa52f25d856b4"}
