{"small_version":"2.0.0","project_id":"project_a89af76cb6a8d3fb5d3e29ac22a0c35d","lineage_id":"lineage_1ae9a2104e6dbeaa037eef39d97d39d2","session_id":"session_9f52191b16868ae8e23aa0353f49e415","event_id":"event_239653f182bdcdb8f288646b0e7af74c","kind":"task_transitioned","sequence":2,"previous_event":"event_40235faf491d995ddc93a3631f9ce439","occurred_at":"2026-09-17T16:22:42.437882Z","task_id":"task_4773bf3c83c7e364d9cde23722d1211a","task_revision":1,"policy_revision":"policy_6e0fa51f664cce0629cd586cac440476","source_digest":"c991b026d1e02dcb4710ce2e85279af13eba3ef49b36cd82a177f469749b51db","payload":{"evidence":"Started the durable continuity example","status":"in_progress"},"digest":"753a3919853a995cb7504d6f849351b1f471798c2bd84737ec015ef87ba741b7"}
