{"small_version":"2.0.0","project_id":"project_a89af76cb6a8d3fb5d3e29ac22a0c35d","lineage_id":"lineage_1ae9a2104e6dbeaa037eef39d97d39d2","session_id":"session_9f52191b16868ae8e23aa0353f49e415","event_id":"event_1f8ad28ce3ea290c242e480c7c556662","kind":"task_transitioned","sequence":4,"previous_event":"event_838ccd84461d233b8660b4a7bcd7ce78","occurred_at":"2026-09-17T16:22:42.601184Z","task_id":"task_4773bf3c83c7e364d9cde23722d1211a","task_revision":1,"policy_revision":"policy_6e0fa51f664cce0629cd586cac440476","source_digest":"c991b026d1e02dcb4710ce2e85279af13eba3ef49b36cd82a177f469749b51db","payload":{"evidence":"Created src/resume-ready.txt through small apply and reviewed the captured command receipt.","evidence_digests":["869d2c9c7d44edcfd8c8524463b2710c5e3fedaf9d576428c2fc97246b0a443b"],"status":"completed"},"digest":"8f4cbb9b5c83ef9cc55e7af29694a3d8048e005470fa519cd2306b2b245cf6bb"}
