{"small_version":"2.0.0","project_id":"project_a89af76cb6a8d3fb5d3e29ac22a0c35d","lineage_id":"lineage_1ae9a2104e6dbeaa037eef39d97d39d2","session_id":"session_fda04d5104f03fa727ae28354384c24b","event_id":"event_0559e8316880833358037414ec1ec149","kind":"task_created","sequence":4,"previous_event":"event_97aaa022a57a8f0d877aba5008d9b221","occurred_at":"legacy-plan-000001","task_id":"task_4773bf3c83c7e364d9cde23722d1211a","task_revision":1,"policy_revision":"policy_6e0fa51f664cce0629cd586cac440476","source_digest":"c991b026d1e02dcb4710ce2e85279af13eba3ef49b36cd82a177f469749b51db","payload":{"acceptance":["Unit tests pass","Integration tests pass"],"alias":"task-2","dependencies":null,"legacy_status":"pending","title":"Implement core functionality"},"digest":"7708640da23f3041d991be8397c8cd1ee150be67753560ba41b3985c2bc84a02"}
