{"small_version":"2.0.0","project_id":"project_a89af76cb6a8d3fb5d3e29ac22a0c35d","lineage_id":"lineage_1ae9a2104e6dbeaa037eef39d97d39d2","session_id":"session_fda04d5104f03fa727ae28354384c24b","event_id":"event_c8507d057c04b4a27e28bbbf93168ecb","kind":"session_closed","sequence":7,"previous_event":"event_66f9444ecf13d389626a68d7f72656b6","occurred_at":"legacy-import-complete","policy_revision":"policy_6e0fa51f664cce0629cd586cac440476","source_digest":"c991b026d1e02dcb4710ce2e85279af13eba3ef49b36cd82a177f469749b51db","payload":{"reason":"migration import session complete"},"digest":"39d682acc1e3a666f95a17420a6f015940c81d17c901be6f9dde6edac91b8651"}
