{"small_version":"2.0.0","project_id":"project_a89af76cb6a8d3fb5d3e29ac22a0c35d","lineage_id":"lineage_1ae9a2104e6dbeaa037eef39d97d39d2","session_id":"session_fda04d5104f03fa727ae28354384c24b","event_id":"event_766d27b31faeaa56a32c6e012b133458","kind":"task_transitioned","sequence":5,"previous_event":"event_0559e8316880833358037414ec1ec149","occurred_at":"2025-01-04T10:00:00.000000000Z#000000","task_id":"task_609f8e11ac87b1e3f291dee5d4fe9fb3","task_revision":1,"policy_revision":"policy_6e0fa51f664cce0629cd586cac440476","source_digest":"c991b026d1e02dcb4710ce2e85279af13eba3ef49b36cd82a177f469749b51db","payload":{"legacy_entry":{"commit":"abc1234","evidence":"Created .small directory with all canonical files","status":"completed","task_id":"task-1","timestamp":"2025-01-04T10:00:00.000000000Z"},"status":"completed"},"digest":"176b4b67c3e8171811f93959a33faad6020de109886f3280da3f80e1054146f0"}
