{"small_version":"2.0.0","project_id":"project_a89af76cb6a8d3fb5d3e29ac22a0c35d","lineage_id":"lineage_1ae9a2104e6dbeaa037eef39d97d39d2","session_id":"session_fda04d5104f03fa727ae28354384c24b","event_id":"event_77cbe97314764fa8ce920e7700db75b6","kind":"v1_imported","sequence":2,"previous_event":"event_079fb9b3fb3f8773bd3c82c038ec6c61","occurred_at":"1970-01-01T00:00:01Z","policy_revision":"policy_6e0fa51f664cce0629cd586cac440476","source_digest":"c991b026d1e02dcb4710ce2e85279af13eba3ef49b36cd82a177f469749b51db","payload":{"import_id":"import_a89af76cb6a8d3fb5d3e29ac22a0c35d","input_digest":"c991b026d1e02dcb4710ce2e85279af13eba3ef49b36cd82a177f469749b51db","namespace":"small-protocol/examples/durable-session"},"digest":"5085d6f399c0b089ea8141b9ee53aa2a85f2dfaba23037aaa1b481603e71788c"}
