{"small_version":"2.0.0","project_id":"project_a89af76cb6a8d3fb5d3e29ac22a0c35d","lineage_id":"lineage_1ae9a2104e6dbeaa037eef39d97d39d2","session_id":"session_9f52191b16868ae8e23aa0353f49e415","event_id":"event_b9e98ead3c6d5f716e44480a72dc89fe","kind":"handoff_recorded","sequence":5,"previous_event":"event_1f8ad28ce3ea290c242e480c7c556662","occurred_at":"2026-09-17T16:22:42.680874Z","policy_revision":"policy_6e0fa51f664cce0629cd586cac440476","payload":{"authoritative":true,"summary":"Core continuity example completed. The project is valid and ready for the next operator."},"digest":"3b80a1132aae96d3c151eff0c0b89c5060d99b6dc3d1ca3e5fed2203a31a97a9"}
