{"small_version":"2.0.0","project_id":"project_a89af76cb6a8d3fb5d3e29ac22a0c35d","lineage_id":"lineage_1ae9a2104e6dbeaa037eef39d97d39d2","session_id":"session_fda04d5104f03fa727ae28354384c24b","event_id":"event_66f9444ecf13d389626a68d7f72656b6","kind":"handoff_recorded","sequence":6,"previous_event":"event_766d27b31faeaa56a32c6e012b133458","occurred_at":"legacy-handoff","policy_revision":"policy_6e0fa51f664cce0629cd586cac440476","source_digest":"c991b026d1e02dcb4710ce2e85279af13eba3ef49b36cd82a177f469749b51db","payload":{"authoritative":true,"legacy_replay_id":"46311ca6450b7e168171e919f8a39de8f980ca0c98870f0e35f2bcc608fe32a0","summary":"Project initialized. Ready to implement core functionality."},"digest":"439fc8fe2dc34ad88d5da71426b59e2f2267045ceb955d630bdd89d1f23f298b"}
