{"small_version":"2.0.0","project_id":"project_a89af76cb6a8d3fb5d3e29ac22a0c35d","lineage_id":"lineage_1ae9a2104e6dbeaa037eef39d97d39d2","session_id":"session_9f52191b16868ae8e23aa0353f49e415","event_id":"event_0657ff15bd4da5a536273bb1b9c0193d","kind":"session_closed","sequence":6,"previous_event":"event_b9e98ead3c6d5f716e44480a72dc89fe","occurred_at":"2026-09-17T16:22:42.739591Z","policy_revision":"policy_6e0fa51f664cce0629cd586cac440476","payload":{"handoff_event":"event_b9e98ead3c6d5f716e44480a72dc89fe"},"digest":"32031571dc63a7fd4dc4b6a167e70d3d753783d0d686cad4f7cc30d2242447c6"}
