{"small_version":"2.0.0","project_id":"project_a89af76cb6a8d3fb5d3e29ac22a0c35d","lineage_id":"lineage_1ae9a2104e6dbeaa037eef39d97d39d2","session_id":"session_fda04d5104f03fa727ae28354384c24b","event_id":"event_97aaa022a57a8f0d877aba5008d9b221","kind":"task_created","sequence":3,"previous_event":"event_77cbe97314764fa8ce920e7700db75b6","occurred_at":"legacy-plan-000000","task_id":"task_609f8e11ac87b1e3f291dee5d4fe9fb3","task_revision":1,"policy_revision":"policy_6e0fa51f664cce0629cd586cac440476","source_digest":"c991b026d1e02dcb4710ce2e85279af13eba3ef49b36cd82a177f469749b51db","payload":{"acceptance":["All five files exist","Files pass validation"],"alias":"task-1","dependencies":null,"legacy_status":"completed","title":"Set up project structure"},"digest":"90cfed678aca274d016d38f0441e5f00a69043d24370007d3f7d4d1648e2e204"}
