{"small_version":"2.0.0","project_id":"project_a89af76cb6a8d3fb5d3e29ac22a0c35d","lineage_id":"lineage_1ae9a2104e6dbeaa037eef39d97d39d2","session_id":"session_9f52191b16868ae8e23aa0353f49e415","event_id":"event_838ccd84461d233b8660b4a7bcd7ce78","kind":"command_recorded","sequence":3,"previous_event":"event_239653f182bdcdb8f288646b0e7af74c","occurred_at":"2026-09-17T16:22:42.52177Z","task_id":"task_4773bf3c83c7e364d9cde23722d1211a","task_revision":1,"policy_revision":"policy_6e0fa51f664cce0629cd586cac440476","source_digest":"fef9f3d0eb39b1bba95a14429fc0542bd14510c97a647c86c27b1b902d629d8d","payload":{"command_sha256":"fef9f3d0eb39b1bba95a14429fc0542bd14510c97a647c86c27b1b902d629d8d","command_summary":"mkdir -p src \u0026\u0026 printf 'SMALL keeps the plan, evidence, and handoff ready for the next session.\\n' \u003e src/resume-ready.txt","evidence_digests":["67e420009d2b49ec65f45d9ea93d06014a4090e4eb89add6232395b4e3ae12d8"],"exit_code":0,"outcome":"succeeded","task_acceptance_unchanged":true},"digest":"ac2a8e0dd296f90ecefdad822f93cef8f895fdafe98ba73151353a10dd379c25"}
